,text,mark
59,учиться на специальность который ненавидеть и не хотеть связывать с она свой жизнь,-1.0
60,она избить до смерть и перед это жестоко насиловать,
61,кошмар заключаться в два момент,-1.0
62,ранний всегда раскаиваться после вспышка но в последний время считать что я сам виноватый и вывести он,-1.0
63,просто потому что неправильно понять смысл предложение не знать что быть завтра не мочь спать я в ужас,-1.0
64,откуда столько агрессия и кто она так промыть мозги ум не приложить,-1.0
65,он взбеситься выволочь я на улица избить кулак по лицо голов,-1.0
66,мочь я неправый но в душа жить сомнение что если бы не операция,-1.0
67,подрабатывать но платить мизер так что терпеть я этот ада ещё хрен знать сколько,-1.0
68,не мочь смотреть человек в глаз никогда в жизнь столько не реветь на ровный место никогда так не болеть сердце,-1.0
69,недавно мой ненависть дошлый до воплощение в жизнь я несколько раз с весь дурь в разгар ссора ударить свой знакомый голова о стеклянный стен и теперь я стать изгой и больной урод в глаз свой немногочисленный друг,-1.0
70,вот и сейчас наорать на я и назвать дура за то что я он не разбудить потому что он неправильно будильник поставить перед работа,-1.0
71,с первое день как только стать встречаться начаться жестокий и беспричинный вынос мозги по повод и без,-1.0
72,это не жизнь а настоящий пытка год это очень много если человек постоянно болеть,-1.0
73,в итог я привыкнуть относиться к себя как к чемуть мерзкий грузный и страшный чемуть что недостойно любовь от что человек уходить с омерзение и ужас,-1.0
74,после похороны родитель обвинить я в чёрствость и бездушность кричать что я опозорить семь раз не биться в рыдание,-1.0
